[
  {
    "id": "BM-AUTH-001",
    "requirement": "BM-AUTH",
    "title": "Phone sign-in",
    "priority": "P1",
    "given": "A registered customer and controlled OTP provider",
    "when": "Submit correct unexpired OTP once",
    "then": "One authenticated session is issued",
    "status": "specified",
    "execution": "manual-or-future-automation",
    "blocking_decision": false,
    "classification": "acceptance",
    "specificationStatus": "specified",
    "automationStatus": "not-implemented",
    "intendedLayers": [
      "api"
    ],
    "platforms": [
      "backend"
    ],
    "fixtureRefs": [],
    "implementationRefs": []
  },
  {
    "id": "BM-AUTH-002",
    "requirement": "BM-AUTH",
    "title": "Wrong OTP",
    "priority": "P1",
    "given": "A pending sign-in challenge",
    "when": "Submit an incorrect OTP",
    "then": "No session is issued and attempts are tracked",
    "status": "specified",
    "execution": "manual-or-future-automation",
    "blocking_decision": false,
    "classification": "acceptance",
    "specificationStatus": "specified",
    "automationStatus": "not-implemented",
    "intendedLayers": [
      "api"
    ],
    "platforms": [
      "backend"
    ],
    "fixtureRefs": [],
    "implementationRefs": []
  },
  {
    "id": "BM-AUTH-003",
    "requirement": "BM-AUTH",
    "title": "Expired OTP",
    "priority": "P1",
    "given": "A challenge past its configured expiry",
    "when": "Submit its previously correct OTP",
    "then": "Challenge is rejected without a session",
    "status": "specified",
    "execution": "manual-or-future-automation",
    "blocking_decision": true,
    "classification": "acceptance",
    "specificationStatus": "needs-decision",
    "automationStatus": "not-implemented",
    "intendedLayers": [
      "api"
    ],
    "platforms": [
      "backend"
    ],
    "fixtureRefs": [],
    "implementationRefs": []
  },
  {
    "id": "BM-AUTH-004",
    "requirement": "BM-AUTH",
    "title": "OTP replay",
    "priority": "P1",
    "given": "An OTP already used successfully",
    "when": "Submit it again",
    "then": "No second session can be created using the consumed challenge",
    "status": "specified",
    "execution": "manual-or-future-automation",
    "blocking_decision": false,
    "classification": "acceptance",
    "specificationStatus": "specified",
    "automationStatus": "not-implemented",
    "intendedLayers": [
      "api"
    ],
    "platforms": [
      "backend"
    ],
    "fixtureRefs": [],
    "implementationRefs": []
  },
  {
    "id": "BM-AUTH-005",
    "requirement": "BM-AUTH",
    "title": "Challenge binding",
    "priority": "P1",
    "given": "Two different phone challenges",
    "when": "Use phone A code for phone B challenge",
    "then": "Verification is rejected",
    "status": "specified",
    "execution": "manual-or-future-automation",
    "blocking_decision": false,
    "classification": "acceptance",
    "specificationStatus": "specified",
    "automationStatus": "not-implemented",
    "intendedLayers": [
      "api"
    ],
    "platforms": [
      "backend"
    ],
    "fixtureRefs": [],
    "implementationRefs": []
  },
  {
    "id": "BM-AUTH-006",
    "requirement": "BM-AUTH",
    "title": "Rate limits",
    "priority": "P1",
    "given": "Configured attempt and resend limits",
    "when": "Exceed the configured limit",
    "then": "Requests are throttled without sending unlimited messages",
    "status": "specified",
    "execution": "manual-or-future-automation",
    "blocking_decision": false,
    "classification": "acceptance",
    "specificationStatus": "specified",
    "automationStatus": "not-implemented",
    "intendedLayers": [
      "api"
    ],
    "platforms": [
      "backend"
    ],
    "fixtureRefs": [],
    "implementationRefs": []
  },
  {
    "id": "BM-AUTH-007",
    "requirement": "BM-AUTH",
    "title": "Logout",
    "priority": "P1",
    "given": "An authenticated customer",
    "when": "Logout and attempt a protected action",
    "then": "The logged-out client cannot perform the action",
    "status": "specified",
    "execution": "manual-or-future-automation",
    "blocking_decision": false,
    "classification": "acceptance",
    "specificationStatus": "specified",
    "automationStatus": "not-implemented",
    "intendedLayers": [
      "api"
    ],
    "platforms": [
      "backend"
    ],
    "fixtureRefs": [],
    "implementationRefs": []
  },
  {
    "id": "BM-AUTH-008",
    "requirement": "BM-AUTH",
    "title": "Session refresh",
    "priority": "P1",
    "given": "A valid refresh session",
    "when": "Refresh credentials",
    "then": "A valid session is returned without exposing credentials in logs",
    "status": "specified",
    "execution": "manual-or-future-automation",
    "blocking_decision": false,
    "classification": "acceptance",
    "specificationStatus": "specified",
    "automationStatus": "not-implemented",
    "intendedLayers": [
      "api"
    ],
    "platforms": [
      "backend"
    ],
    "fixtureRefs": [],
    "implementationRefs": []
  },
  {
    "id": "BM-AUTH-009",
    "requirement": "BM-AUTH",
    "title": "Expired session",
    "priority": "P1",
    "given": "An expired access credential",
    "when": "Request a protected resource",
    "then": "Access is rejected or securely refreshed; no guest privilege escalation",
    "status": "specified",
    "execution": "manual-or-future-automation",
    "blocking_decision": false,
    "classification": "acceptance",
    "specificationStatus": "specified",
    "automationStatus": "not-implemented",
    "intendedLayers": [
      "api"
    ],
    "platforms": [
      "backend"
    ],
    "fixtureRefs": [],
    "implementationRefs": []
  },
  {
    "id": "BM-AUTH-010",
    "requirement": "BM-AUTH",
    "title": "Account deletion",
    "priority": "P1",
    "given": "A signed-in customer with prior orders",
    "when": "Request deletion and complete required confirmation",
    "then": "Access is revoked; data handling follows the documented retention policy",
    "status": "specified",
    "execution": "manual-or-future-automation",
    "blocking_decision": true,
    "classification": "acceptance",
    "specificationStatus": "needs-decision",
    "automationStatus": "not-implemented",
    "intendedLayers": [
      "api"
    ],
    "platforms": [
      "backend"
    ],
    "fixtureRefs": [],
    "implementationRefs": []
  }
]
